<?xml version="1.0" encoding="UTF-8"?>
<!-- TODO: correct the schema location to something like
     http://interoperability-now.org/schema/TIPP/TIPManifest-1-4.xsd -->
<TIPManifest xmlns:xsi="http://www.w3.org/2001/XMLSchema-instance"
  xsi:noNamespaceSchemaLocation="TIPManifest-1-4.xsd" version="1.4">
  <GlobalDescriptor>
    <UniquePackageID>urn:uuid:84983-zzz-0091-alpppq-184903b-aj1239</UniquePackageID>
    <!-- This is the information about the creator of this package -->
    <PackageCreator>
        <Name>Joe the Freelance Translator</Name>
        <ID>http://joestranslations.biz</ID>
        <Update>2011-05-18T19:03:15Z</Update>
        <Tool>
          <ToolName>Kilgray MemoQ Standard Edition</ToolName>
          <ToolID>http://www.kilgray.com</ToolID>
          <ToolVersion>6.0</ToolVersion>
        </Tool>
    </PackageCreator>
    <TaskResponse>
      <!-- The Response repeats what the task was -->
      <Task>
        <TaskType>http://interoperability-now.org/TIPP/schema/tasks/v1/translate</TaskType>
        <SourceLanguage>en-US</SourceLanguage>
        <TargetLanguage>fr-FR</TargetLanguage>
      </Task>
      <!-- Now describe the package we're responding to, using its
          - ID and creation information. -->
      <InResponseTo>
        <UniquePackageId>urn:uuid:12345-abc-6789-aslkjd-19193la-as9911</UniquePackageId>
        <PackageCreator>
          <Name>Welocalize</Name>
          <ID>http://w01.welocalize.com/globalsight</ID>
          <Update>2011-05-09T22:45:00Z</Update>
          <Tool>
            <ToolName>GlobalSight 9.0</ToolName>
            <ToolID>http://www.globalsight.com</ToolID>
           <ToolVersion>9.0</ToolVersion>
         </Tool>
        </PackageCreator>
      </InResponseTo>
      <!-- Now describe the results -->
      <ResponseMessage>Success</ResponseMessage>
      <!-- ResponseComment is intended to store supplemental 
         - (non-machine-readable) information, particularly in error cases.
         - In this case, the field is empty. -->
      <ResponseComment />
    </TaskResponse>
  </GlobalDescriptor>

  
  <!-- For the response TIPP, the STS and preview data is optional and 
     - has been omitted.  The only thing that the "translate" task requires
     - in a successful response is the XLIFF:doc file. -->
  <PackageObjects>

    <PackageObjectSection name="bilingual" 
      type="http://interoperability-now.org/TIPP/schema/tasks/v1/translate/bilingual">
      <ObjectFile sequence="1">
        <Name>Peanut_Buffer.xlf</Name>
        <Location>Peanut_Butter.xlf</Location>
      </ObjectFile>
    </PackageObjectSection>

  </PackageObjects>
</TIPManifest>
